{
  "$schema": "http://json-schema.org/draft-07/schema#",
  "$id": "https://clawrocket.dev/contracts/editorial-room/v0/topic.schema.json",
  "title": "TopicCompiledTruth",
  "description": "Layer-2 page: specific angle within a theme. See EDITORIAL_ROOM_CONTRACT.md §3.2.",
  "type": "object",
  "additionalProperties": false,
  "required": [
    "schema_version",
    "parent_theme_slug",
    "working_title",
    "thesis",
    "why_now",
    "status",
    "novelty_score",
    "novelty_score_basis",
    "derived_from_pcp",
    "pcp_provenance",
    "derived_from_panel",
    "panel_provenance",
    "optimization_round_id",
    "point_count",
    "last_activity_at"
  ],
  "properties": {
    "schema_version": { "const": "0" },
    "parent_theme_slug": {
      "type": "string",
      "minLength": 1,
      "description": "Defaults to 'theme/misc' if user doesn't pick."
    },
    "working_title": { "type": "string", "minLength": 1 },
    "thesis": {
      "type": "string",
      "minLength": 1,
      "maxLength": 200,
      "description": "One-line thesis (≤200 chars)."
    },
    "why_now": {
      "anyOf": [{ "type": "null" }, { "type": "string", "minLength": 1 }],
      "description": "Optional: what makes this timely."
    },
    "status": {
      "type": "string",
      "enum": ["active", "parked", "used", "rejected"]
    },
    "novelty_score": {
      "anyOf": [
        { "type": "null" },
        { "type": "number", "minimum": 0, "maximum": 1 }
      ],
      "description": "0–1, computed against back_catalog."
    },
    "novelty_score_basis": {
      "anyOf": [{ "type": "null" }, { "type": "string", "minLength": 1 }]
    },
    "derived_from_pcp": { "type": "boolean" },
    "pcp_provenance": {
      "anyOf": [
        { "type": "null" },
        { "$ref": "https://clawrocket.dev/contracts/editorial-room/v0/pcp_provenance.schema.json" }
      ]
    },
    "derived_from_panel": { "type": "boolean" },
    "panel_provenance": {
      "anyOf": [
        { "type": "null" },
        { "$ref": "https://clawrocket.dev/contracts/editorial-room/v0/panel_provenance.schema.json" }
      ]
    },
    "optimization_round_id": {
      "anyOf": [{ "type": "null" }, { "type": "string", "minLength": 1 }],
      "description": "ULID of the optimization round that produced this topic, if any."
    },
    "point_count": {
      "anyOf": [{ "type": "null" }, { "type": "integer", "minimum": 0 }]
    },
    "last_activity_at": {
      "anyOf": [{ "type": "null" }, { "type": "string", "format": "date-time" }]
    }
  }
}
