{
  "schema_version": "0",
  "parent_theme_slug": "theme/ai-impact-on-game-dev",
  "working_title": "How Embracer's writedown changed indie publishing terms",
  "thesis": "Surviving studios are signing 2022-rate deals to keep going — Embracer's writedown shifted bargaining power away from devs in a way locked in for 18+ months.",
  "why_now": "Embracer's Q3 8-K reclassified MGs as conditional liabilities; Devolver's prelim Q4 echoed the change; the shape is hardening across mid-tier publishers.",
  "status": "active",
  "novelty_score": 0.82,
  "novelty_score_basis": "Closest prior piece (back_catalog/2025-08-publisher-power-shift) covers Embracer broadly but not the deal-shape implications.",
  "derived_from_pcp": false,
  "pcp_provenance": null,
  "derived_from_panel": false,
  "panel_provenance": null,
  "optimization_round_id": null,
  "point_count": 5,
  "last_activity_at": "2026-04-30T11:47:00.000Z"
}
